{
  "eqo_version": "1.4.0",
  "canonical_edition": "en",
  "artifact": "EQO/1 machine-readable vocabulary export — the registries and enumerations of the standard in one structured file. Consumers (viewers, validators, build pipelines) read this artifact; parsing the specification prose is not a supported interface. Normative basis: SPECIFICATION.md §8.6; content mirrors the specification.",
  "sources": ["SPECIFICATION.md"],
  "spec_anchors": {
    "P": "SPECIFICATION.md#part-ii--registry-p-phenomena",
    "M": "SPECIFICATION.md#part-iii--registry-m-mechanisms",
    "K": "SPECIFICATION.md#part-iv--registry-k-context-facets",
    "E": "SPECIFICATION.md#part-v--registry-e-epistemic-axes",
    "S": "SPECIFICATION.md#part-vi--registry-s-signatures-category-compositions",
    "EP": "SPECIFICATION.md#q4-epistemotypes-named-reference-regions",
    "REL": "SPECIFICATION.md#4-architecture",
    "ROLE": "SPECIFICATION.md#part-iii--registry-m-mechanisms",
    "KIND": "SPECIFICATION.md#83-record-kinds",
    "CONFIDENCE": "SPECIFICATION.md#82-compilation-metadata-and-the-candidates-tier",
    "TIERS": "SPECIFICATION.md#85-doctrine-and-narrative-tiers",
    "RET": "SPECIFICATION.md#84-retractions"
  },
  "phenomena": {
    "classes": {
      "MEC": {"label": "Mechanical", "summary": "Levitation, thrust, spin-up, deformation, oscillation, fluid motion — and mechanical self-runners"},
      "THM": {"label": "Thermal", "summary": "Heat balance, local heating, cooling without a documented sink, anomalous transport"},
      "NUC": {"label": "Nuclear / material", "summary": "Elemental and isotopic analysis, radiation, fusion products, microcraters and new phases"},
      "EMG": {"label": "Electromagnetic", "summary": "Field signatures, induction, electrical energy balance, discharge and plasma, correlations"},
      "GRA": {"label": "Gravitational", "summary": "Weight change, field shadows, gyroscope anomalies, inertia and free-fall deviations"},
      "OPT": {"label": "Optical", "summary": "Glow and aura, plasma balls, refraction and imaging anomalies, mist formation"},
      "ACU": {"label": "Acoustic", "summary": "Spontaneous tones, infra- and ultrasound, resonance transfer over distance"},
      "CHM": {"label": "Chemical", "summary": "Reaction and combustion anomalies, electrochemical figures, phase and substance properties"},
      "BIO": {"label": "Biological", "summary": "Growth effects, physiological sensations, cellular findings, effects on microorganisms"},
      "INS": {"label": "Instrument reading", "summary": "The instrument reading is the sole observable, or the instrument itself is affected"},
      "SON": {"label": "Other", "summary": "Residual — anything the classes above do not cover"}
    },
    "reserved_classes": {
      "ENV": "Environment/geophysics (weather-modification and seismic claims) — namespace reserved, unpopulated",
      "PSI": "Mental-influence claims — namespace reserved, unpopulated"
    },
    "leaves": {
      "P-MEC-LEV-01": "Levitation of rigid bodies (free suspension)",
      "P-MEC-LEV-02": "Levitation of liquids/droplets",
      "P-MEC-LEV-03": "Near-ground hovering/gliding, or anomalously easy handling of heavy objects",
      "P-MEC-KIN-01": "Directed thrust on an apparatus (observed, or measured on balance/torsion balance)",
      "P-MEC-KIN-02": "Self-propelled translation of objects",
      "P-MEC-KIN-03": "Spontaneous spin-up/rotation of resting objects",
      "P-MEC-KIN-04": "Precession behavior deviating from model (incl. Foucault pendulum plane)",
      "P-MEC-KIN-05": "Abrupt stopping/reversal of moving objects",
      "P-MEC-KIN-06": "Spontaneous alignment of objects",
      "P-MEC-KIN-07": "Motion response deviating from the force/inertia budget",
      "P-MEC-KIN-08": "Friction/drag change beyond material constants",
      "P-MEC-KIN-09": "\"Walking\" of electrodes/contacts",
      "P-MEC-KIN-10": "Continued motion without documented energy input (mechanical self-runners)",
      "P-MEC-DEF-01": "Metal deformation without documented signs of heating",
      "P-MEC-DEF-02": "Bursting/fragmentation",
      "P-MEC-DEF-03": "Splitting/tearing",
      "P-MEC-DEF-04": "Cold joining/fusing (visual/mechanical; analytic finding is P-NUC-ELM-03)",
      "P-MEC-DEF-05": "Embedding of foreign bodies in solids",
      "P-MEC-DEF-06": "Temporary softening/plastic state (\"jellification\")",
      "P-MEC-OSZ-01": "Visible vibration without documented excitation",
      "P-MEC-OSZ-02": "Pendulum damping/amplitude anomalies",
      "P-MEC-FLU-01": "Fluid motion without documented drive (vortices, climbing)",
      "P-MEC-FLU-02": "Self-organization/pattern formation of particles",
      "P-MEC-SON-01": "Other mechanical observables",
      "P-THM-BIL-01": "Heat output in excess of accounted input (calorimetry)",
      "P-THM-BIL-02": "Heat generation spatially separated from the apparatus",
      "P-THM-LOK-01": "Local heating/hotspots without accounted input",
      "P-THM-LOK-02": "Metal melting at room ambient",
      "P-THM-LOK-03": "Spontaneous ignition without ignition source",
      "P-THM-LOK-04": "IR signature without corresponding contact/ambient measurement",
      "P-THM-KLT-01": "Cooling without documented heat sink",
      "P-THM-KLT-02": "Cooling of current-carrying conductors under load",
      "P-THM-KLT-03": "Frost/condensation without corresponding ambient conditions",
      "P-THM-TRN-01": "Temperature gradient against expected heat flow",
      "P-THM-TRN-02": "Heat conduction deviating from material constants",
      "P-THM-TRN-03": "Thermal oscillation",
      "P-THM-PHW-01": "Evaporation/phase change below equilibrium conditions",
      "P-THM-SON-01": "Other thermal observables",
      "P-NUC-ELM-01": "Changed elemental inventory in before/after analyses",
      "P-NUC-ELM-02": "Isotope-ratio shift",
      "P-NUC-ELM-03": "Elemental intermixing in joint zones (analytic finding)",
      "P-NUC-ELM-04": "Detection of fusion products above expectation (He-4, tritium)",
      "P-NUC-ELM-05": "Elemental balance shift in organisms",
      "P-NUC-STR-01": "Emission of ionizing radiation without documented source",
      "P-NUC-STR-02": "Neutron emission",
      "P-NUC-STR-03": "Residual radioactivity after experiment",
      "P-NUC-STR-04": "Fission signatures under low-energy conditions",
      "P-NUC-MAT-01": "New phases/nanoparticles (analytic finding)",
      "P-NUC-MAT-02": "Microcraters/explosion traces on surfaces",
      "P-NUC-SON-01": "Other nuclear/material-analytic observables",
      "P-EMG-FLD-01": "Monopole-like/unipolar field signature",
      "P-EMG-FLD-02": "Longitudinal/scalar propagation signatures",
      "P-EMG-FLD-03": "Magnetic-field reversal without current reversal",
      "P-EMG-FLD-04": "Field shielding/enhancement deviating from model",
      "P-EMG-FLD-05": "Field focusing/local concentration",
      "P-EMG-IND-01": "Induction without relative motion/flux change",
      "P-EMG-IND-02": "Capacitance/inductance values deviating from geometry and material",
      "P-EMG-IND-03": "Permittivity values deviating",
      "P-EMG-IND-04": "Negative differential resistance/anomalous characteristics",
      "P-EMG-BIL-01": "Measured electrical excess power (COP > 1)",
      "P-EMG-BIL-02": "Continued operation of electromagnetic systems without accounted input",
      "P-EMG-BIL-03": "Self-recharging of storage devices",
      "P-EMG-BIL-04": "Energy pickup via antenna/ground arrangements",
      "P-EMG-BIL-05": "Voltage/current generation under gradients or load (thermo-, piezo-, triboelectric, photovoltaic instances)",
      "P-EMG-ENT-01": "Plasma/discharge formation at atypically low voltage or with work output",
      "P-EMG-ENT-02": "Electrostatic anomalies under AC",
      "P-EMG-ENT-03": "RF bursts without identified source",
      "P-EMG-KOR-01": "Correlated signals without documented transmission path",
      "P-EMG-SON-01": "Other electromagnetic observables",
      "P-GRA-GEW-01": "Weight change under influence (sign/magnitude as measured value)",
      "P-GRA-GEW-02": "Reduced weight in the \"field shadow\" of an apparatus (static)",
      "P-GRA-GEW-03": "Rotation-bound weight change",
      "P-GRA-GEW-04": "Gyroscope weight anomalies",
      "P-GRA-GEW-05": "Spatially bounded zone of deviant weight measurements",
      "P-GRA-INR-01": "Acceleration response deviating from applied force",
      "P-GRA-INR-02": "Free-fall acceleration deviating from local g",
      "P-GRA-INR-03": "Directional anisotropy of g/weight measurements",
      "P-GRA-SIG-01": "Periodic/transient signals in gravimeters and balances",
      "P-GRA-SON-01": "Other gravitational observables",
      "P-OPT-EMI-01": "Visible glow/aura on apparatus or objects",
      "P-OPT-EMI-02": "UV/IR emission without thermally corresponding source",
      "P-OPT-EMI-03": "Luminescence under mechanical, acoustic, or electrical action",
      "P-OPT-EMI-04": "Cherenkov-like radiation",
      "P-OPT-EMI-05": "Color shift/spectral anomaly",
      "P-OPT-PLS-01": "Plasma balls/ball-lightning-like appearances",
      "P-OPT-PLS-02": "Discharge action without visible glow",
      "P-OPT-MED-01": "Refraction/propagation anomalies",
      "P-OPT-MED-02": "Anomalies in the image content of recordings (device malfunction is P-INS-ELK-01)",
      "P-OPT-MED-03": "Mist/haze formation around apparatus",
      "P-OPT-SON-01": "Other optical observables",
      "P-ACU-EMI-01": "Spontaneous tones/whistling",
      "P-ACU-EMI-02": "Infra-/ultrasound without documented source",
      "P-ACU-EMI-03": "Tonal emission from solids",
      "P-ACU-TRN-01": "Resonance/vibration transfer over distance",
      "P-ACU-SON-01": "Other acoustic observables",
      "P-CHM-RKT-01": "Gas evolution deviating from the reaction budget",
      "P-CHM-RKT-02": "Material decomposition without documented oxidizer/solvent",
      "P-CHM-RKT-03": "Deviant corrosion behavior",